{
  "schema_version": "candidate-index-v2",
  "candidate_id": "candidate-test",
  "candidate_sha256": "aaaaaaaaaaaaaaaaaaaaaaaaaaaaaaaaaaaaaaaaaaaaaaaaaaaaaaaaaaaaaaaa",
  "page_map_sha256": "32844a5664f8af36ae5ecdf6851b9aa4c9195f8b7cdea51fbf4553bc6f4ebcb5",
  "records": [
    {
      "record_id": "REC-001",
      "record_type": "page_bearing",
      "path_id": "PATH-001",
      "heading_path": ["Revolution", "economic causes"],
      "original_displayed_form": "Revolution — economic causes, 1, 4",
      "locator_displays": [
        {
          "display_id": "DISPLAY-001",
          "displayed_locator": "1",
          "kind": "point",
          "range_id": null,
          "mapping_status": "resolved",
          "locator_ids": ["LOC-001"]
        },
        {
          "display_id": "DISPLAY-002",
          "displayed_locator": "4",
          "kind": "point",
          "range_id": null,
          "mapping_status": "resolved",
          "locator_ids": ["LOC-002"]
        }
      ],
      "locator_assignments": [
        {
          "locator_id": "LOC-001",
          "display_id": "DISPLAY-001",
          "displayed_locator": "1",
          "source_page_label": "1",
          "normalized_locator_key": "1",
          "document_page": 5,
          "mapping_status": "resolved",
          "range_id": null
        },
        {
          "locator_id": "LOC-002",
          "display_id": "DISPLAY-002",
          "displayed_locator": "4",
          "source_page_label": "4",
          "normalized_locator_key": "4",
          "document_page": 8,
          "mapping_status": "resolved",
          "range_id": null
        }
      ],
      "cross_references": []
    },
    {
      "record_id": "REC-002",
      "record_type": "page_bearing",
      "path_id": "PATH-002",
      "heading_path": ["Appendix material"],
      "original_displayed_form": "Appendix material, A-1",
      "locator_displays": [
        {
          "display_id": "DISPLAY-003",
          "displayed_locator": "A-1",
          "kind": "point",
          "range_id": null,
          "mapping_status": "resolved",
          "locator_ids": ["LOC-003"]
        }
      ],
      "locator_assignments": [
        {
          "locator_id": "LOC-003",
          "display_id": "DISPLAY-003",
          "displayed_locator": "A-1",
          "source_page_label": "A-1",
          "normalized_locator_key": "a-1",
          "document_page": 9,
          "mapping_status": "resolved",
          "range_id": null
        }
      ],
      "cross_references": []
    },
    {
      "record_id": "REC-003",
      "record_type": "cross_reference",
      "path_id": "PATH-003",
      "heading_path": ["Economic origins"],
      "original_displayed_form": "Economic origins. see Revolution—economic causes",
      "locator_displays": [],
      "locator_assignments": [],
      "cross_references": [
        {
          "reference_id": "XREF-675042835077",
          "type": "see",
          "target": "Revolution—economic causes",
          "target_path_id": null,
          "original_displayed_form": "Revolution—economic causes"
        }
      ]
    }
  ],
  "normalization": {
    "engine": "synthetic-current-format-fixture",
    "engine_version": "2.0.0",
    "record_count": 3,
    "main_heading_count": 2,
    "subheading_count": 1,
    "complete_heading_path_count": 3,
    "displayed_locator_count": 3,
    "expanded_locator_assignment_count": 3,
    "cross_reference_count": 1,
    "unresolved_locator_count": 0,
    "editorial_corrections_applied": false,
    "benchmark_content_used": false
  }
}
